{
  "$schema": "../../schemas/v1/adapter-manifest.schema.json",
  "adapter": "opencode",
  "adapter_version": "0.3.0",
  "supported_protocol_versions": { "minimum": "1.0.0", "maximum": "1.x" },
  "declared_conformance_level": 2,
  "runtime_capabilities": "../../runtime/opencode.json",
  "validation": {
    "last_tested_at": "2026-07-20",
    "test_status": "structural_only",
    "report": "../../docs/adapter-validation/opencode.md"
  },
  "limitations": ["Parallel execution depends on host runtime support"]
}
